tweet_id,processed_tweet
1,oh owies happen
2,follow back twitter sm twitter
3,todaay lets show nottingham things done
4,cant sleep
5,yes thanks reaveling world bro fuck life hahaha
6,awe always sucks cant sleep bed hope dad gets better prayers
7,straight outta hak mob months actually gettin twitter ive cont
8,arrgghh hadnt seen last nights episode yet pity lose though
9,think kelly clarkson new album pumping mp3 player weeks
10,hi im new twitter
11,nigga need go twitter jail
12,good night sweet dreamz
13,twitter hope never stop dreaming dreams fuel soul love dreaming big seeing happens
14,possible today nice
15,microsoft arrogance ballmer says need computer scientist use android
16,thinking big v twin
17,good night twitter
18,damn b espanol francais one talented lady
19,thanks allan photos joolz soiree held brisbane last year
20,morning everyone still feeling poorly hope u good day x
21,oh wtf house cool
22,hot deadline
23,mock
24,feel like promoting anyones twitter page want get promoteback twitter
25,twitter statuses youd never post facebook
26,ugh allergies killing tonight house driving crazy run live bubble together yes
27,strategic technology agenda twitter strategy
28,u couldnt tweet phone lot people wouldnt twitter broke fact
29,woohoo yeah day rockin hard core
30,welcome twitter
31,going month ugh
32,train travelling speed get gym work
33,didnt get twitter crap reply
34,wish dunkin donuts holland today moms back japan cant wait see
35,ty simply da best twitter tweeps
36,guys mentioned haha cool ive posting random stuff past getting kick
37,found great chinese place hang
38,microsoft dynamics gp soon offer hyperv images
39,
40,im officially going bed goodnight
41,ok sleep magnetic mattress gnight sweet dreams
42,twitter making ass stay later planed
43,correction dont tell cert use different matter without win yet another
44,drizzling day u going rain might well pour
45,went doctors today blood sugar level
46,international font looks ugly going back original font whod tweet malayalam
47,avatar teh purdiness
48,google mobile boss andy rubin apple microsoft tablets live asiad ina fried mobile allthingsd
49,cute friend finally got twitter EMO_POS
50,early twitter buzz star trek secret premiere austin holy crap wish
51,solution found
52,nessun realmente guess mean
53,flu shot work arm hurts
54,youre dead set legend please make broadbands super fast love forever
55,mom root canal also feel pain buddy
56,microsoft idea search internet like celebrity todd
57,u write back twitter miss ya garee x
58,oomf dnt start dis twitter
59,really heavy rain top building splendid
60,much appreciate information thanks
61,twitter
62,ok tweet peep must head bed got take test law tomorrow summer yet anyway much love huggers
63,omni touch screen system going beyond touch screens featured microsoft omnitouch
64,twitter great get hang told get one cool kid
65,break bible share scripture
66,money yet dont know anyone maybe lie hes us like little bit lol
67,im sur ehon im coming people like days bout yall come ot la
68,ads yet appeared google adsense team said may delay hrs
69,called hunnybunny miss already night lova
70,twitter followers either like sense humor sex appeal guess im funny lol
71,shares yeheeyy karma gone
72,finished nails electric blue
73,im feeling somewhat artistic time break sketching pad feel new dress design coming
74,cuz like troybolton hottiemcsuperbob omfgz nail buds cries
75,one serious statement tho twitter
76,need speak sum real shit twitter
77,twitter aint broke trent got plenty dough
78,music today blip.fm undergoing maintenance
79,oh aint gonna ur bitch muwahaha
80,hope feel better cali
81,mine
82,ihateitwhen think cool da tym grab da fone load twitter would forgotten dumbass
83,rocks dont tell said
84,one freaky movie like got
85,want guy like carmello jimmy
86,wonder long stay pass wake
87,still waiting missing baby boy
88,ah hate flu third day guess happened accidently shaved eye brows need glasses
89,dinner menu week something pastay cheese also chicken noodle soup
90,twitter
91,much traffic a2 cant wait till lanes ready
92,microsoft cloud getting started microsofts windows azure cloud lay good tools integrat tcn
93,yay finally lmao
94,really hungry grabbed ice cream freeze
95,twitter reformat urls t.co
96,extravagant yet time conserving plan lined today ive forgotten
97,bad day today bad loved seeing sancha
98,hit elbow really hard door
99,hey im place around time come twitter
100,goodnight twitter see morning another successful day
101,use twitter generate traffic website
102,hahahaha istilah yang aneh
103,baha leave start fight grr oh well atleast makes amazing entertainment
104,im set except ill watch huge membered guys feel like hat stand
105,sad know andy hallet died
106,aint shit twitter untill every girl following goalset lol
107,directly share facebook photos twitter
108,dont understand didnt mean break anyones heart
109,whats good twitter
110,twitter age days hours minutes seconds find twittertime
111,paragon please vote work lol
112,finished cooking spag bol scratch words cooking past hours im hungry anymore
113,ha ha ha damn good time chillin wit favorite hizzo danced face lodge never made backbooth
114,oh oh found clothes love em xd
115,microsoft ceo steve_ballmer buying yahoo
116,know compo reppin twitter
117,first unc dominated second hills back hallelujah third econ paper gaussian copula def deal
118,goodmorning hahaha let guess cb hahaha
119,everyones clarification run law anything quiet months trying go
120,ways use twitter business
121,got tweets sorry distracted two heavenly bodies
122,understand busy tweet work
123,microsoft shows touch screen surface nanotech circuits blog cnet news via
124,oh went clubbing without lol next time together
125,im confused sucks
126,thanks
127,side bridge hope
128,thinks factorial designs going death test comes confusing stuff ugh
129,sleepin halo tonight leave
130,shout ou followers twitter
131,ballmer feels lucky microsoft didnt buy yahoo gdapps ballmer microsoft yahoo
132,went calgary lads gaspar sit boot watch flames versus la kings calgary nice night
133,problem rabbits blib
134,follow twitter like foundation facebook together stop humantrafficking
135,microsoft shows touch screen surface microsoft
136,course good one
137,theres always something good happening lives open eyes take time realize
138,going watch julian play bball want phoebe
139,airlie sick mason sick going miss school disco
140,beiing naughty
141,ok put bible verses encouraging post god twitter make sure stand words cause
142,ahh fuck goodnight twitter
143,intervate wins content management partner year microsoft techedafrica
144,im good strange dreams last night hey dreamin means im sleepin hows morning
145,caramba mais de dias ninguem fala em mim ou de mim aki twitter nem mesmo minha noiva fuieskecido
146,microsoft conferencecall
147,twitter buzz builds occupy_wall_street movement
148,huge headache gotta go work
149,town forgot charge phone dont think last day
150,everything digital microsoft carnegiemellon
151,ya
152,brody friend
153,im sorry im neetball deeb nah jennys mine talks facebook
154,really let gossip girl make mondays good give reruns
155,budget method going broke methodically
156,good morning wish weather good germany today
157,ahh see see im bed watching ugly betty lol
158,havent since turned
159,extremely hungry
160,congrats big winners get certifiedget happy sweepstakes ez microsoft
161,twitter age years days hours minutes seconds find twittertime
162,new microsoft security essentials v2.1 released updated antimalware engine microsoft securityessentials windows
163,infosys tied microsoft provide cloudbased offerings clients cloud infosys microsoft technews
164,monsters vs aliens fantastic ginormica new favourite superhero
165,cant sleep windy scary
166,twitter know think funniest member modernfamily cast
167,volunteer hunch beta invite
168,haha im silly id need another job first got plans motion moving overseas anyhow
169,youre going mexico easter
170,god faithful god said promising promising time bed tomorrow may bring another beautiful day goodnight luvs
171,strangest feeling weve done exact thing arial microsoft
172,alexthe_assholebabb new twitter name
173,hard balms get excited android phones microsoft isnt collecting enough royalties yet isaidit
174,testing windows developer preview microsoft
175,shout single mothers twitter
176,lets honest twitter nothings trending en
177,thanks lp endorsement
178,friend asked best man guess means trip twin falls id next year responsibilities best man
179,using touchscreen pocket made possible microsoft pockettouch
180,couple changes twitter
181,heyy loves finished record studio going kick lauren c byee
182,agree doesnt love us much cuz comes visit us fanclub chat
183,watching hairspray normal updated myspace btw check lauren EMO_POS
184,note dont go choclate bar schiphol passengers
185,top twitter related sites design twitter
186,painting clothes
187,twittertips bar runs like dream ff
188,thought going bed reply jon donnie
189,insane husband tho sure
190,however im turning status updates u becuz insomnia ull wake allowed
191,dont get hyphy east coast even e40
192,good night
193,wish cool
194,early im running late
195,watching keith late rerun daily show michael j fox guest high school crush
196,everything digital surface courtesy microsoft carnegie mellon microsoft carnegiemellon
197,steveballmer called computer scientist EMO_POS microsoft android
198,clean resulted soft top beaing soaked wet open dry
199,dont time dont really care everyone world facebook twitter care look
200,yay jon activist wooho
201,humm istore alot similiar reqs maybe head way
202,jammers302 killin twitter follow us
203,aww dont make blush
204,thanks prayers days difficults
205,need get yvonne blackberry twitter account
206,everyone reppin texas dallas mad love good nite yall
207,twitter age year days hours minutes seconds find twittertime
208,podrian dar el face twitter del chavito qe siempre traee lentess transparentes le dicn chicken little x fiiss EMO_POS
209,needs study quant legal process assessment
210,microsoft discontinued product named ensemble studios october review comment
211,rumor new screen sizes specs coming windows phones windowsphone microsoft neowin
212,didnt know wad test downloadable twitter cheat sheet
213,lol wasnt complaining making sure wasnt getting cleared
214,juz watchin eps show hm must say instantly became fan urs lovin ur humor mucho power u
215,dont worry matey im still around trying juggle podcasting life internet life
216,found sana realized like white girl eat problems
217,aw thanks lets hope worried geoffs teeth hope good day h hb
218,ouch imagine toothpic eye something
219,blogspot haha
220,burnt fingers hot cup tea ouch
221,followers none acknowledge
222,way im gonna sleep tonight
223,going school dt
224,bro update twitter link youtube twitter.com tweeter.com
225,wow jus made twitter really dnt kno o2 use neea alittle help
226,broke ya record got witness yaay
227,facebook fucked
228,making bad decisions
229,way earth answer everyone ask donnie got gift yr old lastnight
230,signed
231,great hosting dont know domain check
232,trip canceled see latest blog post info
233,whts goin twitter fam
234,fuckyoumean pittsburgh dont got best twitter
235,im getting ready drink tea emmas gonna eat rice meal
236,boo another day work go days
237,gefelicidingest
238,real tell ur man ur gfs roasted ex twitter hes like good job babe lol
239,ahh sound advice
240,miss free week yuri something
241,lmao well thats que bye twitter oomf finna start quotin lines atl lol
242,holy hell epic aporto burger epic amounts chilli sauce
243,new version cloud intune available posted windows news microsoft released
244,think im addicted checking email twitter facebook
245,omg girl woke reason doesnt matter cant fall back sleep gotta b maybe ill stay
246,rowr bet going bed im sure would want included well lmao
247,hahaha im taking hrim think basic math
248,answer sent dm try
249,hate morn workouts bc love sleep late ha fun mexico love show trip gonna air keeping
250,senews microsoft extends revenue guarantees yahoo yahoo microsoft
251,wishh twitter would tell retweets stuff
252,shouldve clarified cant everything work
253,need study vocabb twitter
254,wow thats something unique wonder trace roots
255,im pretty sure show part show like twitter whole nin fan community
256,started getting mailshots aimed pensioners downhill
257,watching paranormal state.pretty interesting
258,need facebook fans twitter followers youtube views nvida2 freelance job
259,pls let us know need help music marketing promo got twitter youtube lock
260,
261,stuff find twitter lolz lmao
262,im always late wish morning person im
263,back work although wish back bed
264,return shirt bought topshop bc bank account last rest month life sucks
265,microsoft launches reseller rewardhub resllers
266,like school except theres even homework everyones lot nicer normally
267,ur welcome yes accounting exam today
268,vote yayy
269,curiosity doesanyoneknow twitter tos use hashtags eggregiously seem tonight
270,im much twitter lurk use anyway though
271,would meant spending day heaven mom getting see
272,never late thanks hard hard concentrate taking screencaps
273,god sho love feeling really really blessed
274,thinking thinking thinking thinking dotnet asp microsoft
275,coke minority stake really april fool give back depressing favourite brand sad
276,
277,wont tweeting much tonight maybe tweets come form tweet vomit later morning
278,new innotive program coming dubai featuring microsoft qualifications please
279,could really eat cheese hankering austrian smoked cheese yum
280,standing richardson office changing backup tape im workaholic
281,omnitouch microsoft makes every surface touchscreen gadgets
282,feel like preaching lol damn im guilty
283,cold buee
284,hate phne want twitter
285,cried heard girl tracy found today soo sad may god bless sandra cantu
286,ordered copy hardcore underground love love canary skinny jeans going balls deep
287,wye river really cold internet really expensive
288,michael crichton
289,think im love
290,forehead starting feel like someone cut slice oh thats right someone cut slice forehead today
291,wow x60s dead
292,people arent wanna perceived twitter please believe im crazy bitch work slaps everyones ass line
293,wishing could sneak watch star trek premiere
294,hey neighbor neither
295,awesome see
296,beware phone scam calls pretending microsoft claim machine virus
297,watching seven pounds mom hope dont fall asleep aftermidnightproject tomorrow
298,twitter pleasure go exercise eat dinner possibly back b4 sleep well c blessed
299,yay tomorrow get today
300,change nick longer see tweets timeline anything wrong twitter
301,eww hershys kisses ok amazing
302,woken someone hammering stopped cant get back sleep
303,nodame cantabile think im falling love classical music
304,listening dashboard good mann definitely takes memory lane good night kids
305,dont see point following news station twitter theres breaking news people gunna tweet anyway obvs
306,ballmer buying yahoo via microsoft
307,good point draw dont nice quote though like
308,never thought could hate sombody really hate gave love pay bad
309,twitter fdp
310,amazing news im stoked follow see comes next ready
311,microsoft talks start menu search windows microsoft search start windows8
312,twitter age years days hours minutes seconds find twittertime
313,really go sleep get early tomorrow well today
314,twitter woke
315,brahbrah ugh bed hour
316,lol freak session wit ya wifey eh hah
317,marathon
318,yeah
319,wishing sleep day got practice gn twitter
320,good time eat n park drinking latte playing munchkin impossible
321,shit lame trynna fuck somebody dm twitter thoo
322,physically tired cant sleep
323,allergies playin like mad today
324,senews ballmer buying yahoo sometimes youre lucky microsoft yahoo
325,jenny knows love er
326,windows phone tango apollo rumors suggest new screen specs microsoft windows
327,area nightclub making bewilldered uni students arrived home poor folk like struggle
328,microsoft wireless keyboard review wirelesskeyboardandmouse mousecombos
329,lovin johnnyvegas twitter
330,watching princess want wesley
331,shes ritz lol ok gig got planned
332,guys bill gatess associates makes feel like know nothing dont even know name
333,yep lol bored edward hunting guys
334,twitteron
335,microsoft edu ud school board seats grabs delaware county daily times
336,microsoft windows server r2 enterprise oem preisvergleich bewertung softline24 test microsoft
337,cool blink song
338,think needs cool roll twitter game
339,goodnitee twitter
340,butting poop
341,put twitter autopilot let gain followers teamfollowback twitter autopilot
342,sorry wasnt wrath khan made
343,ill drinks anybody pull boy named sue johnnie cash
344,watch short video microsoft lync end user adoption practical solution users itpro ucoms ocs whymsft
345,err oops could possibly mistaken didnt know aussies follwed lol
346,heute microsoft office home student product key card statt nur
347,sounds fair horrible going repeat guess text sent would better whee
348,got blade twitter streets third shift
349,lovely man cooking dinner going walk
350,want make twitter
351,aww depressing
352,follow twitter like foundation facebook together stop humantrafficking
353,oh ok gonna go buy one come
354,photos try upload big
355,sleepy head chances actually sleeping slim fucking none
356,almost late work ten minutes get ready lack sleep consequences factory friday beachbar sunday
357,bout pull see twitter ass gone flip
358,twitter im coming home im coming home tell world im coming home lls
359,twitter age year days hours minutes seconds find twittertime
360,hey nph whats strippers youre following
361,im morning person never prefer night
362,oh god ow must hurt like bitch
363,guipulp open
364,picnic fabulous
365,im thinking getting old fm tuner garage im problems pc stops playing audio
366,solar simple symbol underscore twitter tweet
367,progress process surprised see sensible topic trending worldwide twitter
368,nay b bao
369,vincent mugambi microsoft takes us wp app
370,need go lazy
371,sos real common days
372,patent wars google vs samsung vs apple vs motorola vs microsoft vs oracle
373,aahh finally done next stop zippys
374,freakin cool doesnt shit like happen
375,good moorning world dream last night fucked knee def need kick start strengthening ready bournemouth
376,training course today hope stay awake
377,installed new twidroyd twitter android phone free give try
378,good seeing lip service last week
379,working new cricket game iphone guys like sure
380,thank spent ages thursday tidying along came everyone looked like right tip
381,hard
382,maybe jordan could help answer idea
383,sounds good wish could done im determined find park better
384,twitter statuses youd never post facebook
385,week fitness challenge im starting strong submitted stats night aint bad
386,boy stop pssh
387,neither nobody awake nobody im drunk alone
388,facebook twitter spongebob nirvana great way spend night
389,mucho research today want crack sweet charity auction fic really really
390,woke dis morning im stil alive twitter
391,still trying sell prelude
392,oovoo dumb ass excuseme twitter
393,hamu tour tm im excited
394,bill beckett lovato homies knew
395,well im kinda really bored right time waste time reading quotes twitter
396,told microsoft minute sconds second minutes EMO_POS
397,maybe ill see mean like going thousands people anyways ha stoked
398,u asked earlier waking guess waking bullshittery past bedtime night guys
399,llss.yea kno.lol.i aint fuckin wit dis joint.i guess twitter missed tho huh.slss.lol
400,home hmm lovely degree weather
401,today great roommate played soccer also got nice run sunny day time reading sleep
402,got denied letter bazaar bizarre sad looking forward road trip vendor
403,stuck facebook sorry twitter google facebook
404,sick today lot work
405,agree much productive without twitter
406,send warmness way cold
407,twitter apologize line regardless sum1 promise remain humble keep public ey
408,hurry first person publish book twitters
409,im microsoft served cake lunch ok cake definitely involved live good life
410,cutest dog ever whats name
411,cold playing outside yesterday
412,nooning wedding old man sharted throwing moon pies venture macon georgia
413,need selsun blue pretty sure small spot haole rot
414,gosh soo tired want go back sleep
415,almost finished new moon didnt work tomorrow would totally finish tonight geez
416,get twitter marketing campaigns built seo expert
417,hello jonathan didnt know tweet good nite
418,magic happens every month lol sophia terrific job usual gonna dinner
419,still coffee day happy tuesday see jeff dunham achmed dead terrorist tonight
420,teamfollowback microsoft investigating windows phone mango zune freezing problems
421,one fill position theyve tightened borders something sucks want move
422,thinking hes going reinstall wow simply refuses update irritating times itll take forever
423,bedtime good night twitter goodnightworld
424,someone needs give baby home would bit soon
425,lovatics wanna fan book let know ill send wat needs2b via twitter
426,ways use twitter classroom education ntchat
427,facebook worth business smm socialmedia twitter
428,tt well needed cuz thought twitter dien
429,hella excited cuz italian
430,tell u spoken fb twitter fire right hope ur feelin better love great night
431,zz twitter
432,editing wedding shots begins
433,ate piece angel food cake another laffy taffy
434,guess counting sheep didnt work hope get sleep
435,dad admitted hospital yesterday want fly cape town visit r1900 monday return ticket kulula
436,microsoft ceo steve ballmer buying yahoo uncategorized
437,walked door microsoft kenyaopendoor conference
438,put twitter autopilot let gain followers teamfollowback twitter autopilot
439,cant wait ball season start weeks getting ball equipment home week
440,back school school two weeks
441,go hover tweet favorites tweet favorite unfavorite
442,would want send traffic page bottom say youre done
443,retweet babymamadrama babydaddydrama twitter everyone read blog
444,u say u real time kill asap everybody fake moments dont front twitter
445,like kissing little pink puss lls twitter dark
446,bout tweet tweeting twitter seahawkswag
447,mhbigcatch golem finally got wight
448,stupid make stomach hurt
449,ordered pita nevr came say fax machine broke driver left empty belly
450,
451,zombies cute cupcake form necklace
452,tune hotels opened bookings brand new rooms upcoming new hotels kuching
453,sleep goodnight twitter
454,eat lunch
455,blimmin heck im slightly tired still didnt see otalia
456,need step twitter game teamfollowback miami ff
457,cheeck thiss hand cuz im marvelous EMO_POS boy idk hoow im gona make threw week
458,twitter needs save tweet text function could st save recent msg twitter site read later
459,help
460,crazy pollen trees washington state making sinuses go crazy
461,thanks twice work start date put back maybe thursday maybe easter
462,wonder jon thinks sees tweets picture jordan busting nut laughing us oh yeah jordan
463,twitter thank you.read great tweets.helps live better EMO_POS bows
464,diet woke hungry
465,looking seem getting completely different config finding shared hosting hard control
466,rumor new screen sizes specs coming windows phones windowsphone microsoft neowin
467,need holiday one day year
468,far kinda really liking espresso dreamweaver handcoding ftw
469,twitter
470,omfg gates ballmer nightattheroxbury microsoft
471,loves drupal file framework module could sick bitcache errors making impossible upload files
472,microsoft windows phone update released
473,happy birthday jaime officially screwed right midterm quiz projects page book shoot please
474,surface touch microsoft technology
475,coming guy microsoft pc mug pen everything fail phones.windows phone rescue
476,microsoft finalises skype deal business news features skype micr
477,put twitter autopilot let gain followers teamfollowback twitter autopilot
478,ur gonna delete like feel like jerry maguire got fired right yo lol
479,newing twitter
480,really dnt like follow people never twitter
481,sometimes get lost twitter end living vicariously people massconfusion
482,microsoft scvmm session u need know new version e2evc register
483,congratulations softline pastel winning isv year microsoft partnersummit
484,heute microsoft office home student product key card statt nur
485,yoo nigga soo blowed forgot bout twitter im bkk
486,dont neither
487,train sans guardian
488,twitter adam levine takes aim evil fox news starts twitter spat tweezard
489,right saying good said good night xoxo
490,new post microsoft windows home premium home microsoft premium
491,big data cloud hype real workload azure hpc microsoft
492,microsoft changes yet design windows eight
493,sorry say still air
494,woke far early coffee
495,time warcraft yes simple game group fans let us know u figure want prize
496,wow epicfail search epicfail didnt see many entries apparently widely used im depressed
497,sweet yea im ok
498,brain hurty squishy mess
499,bad thing aids catch id want inflict pain deadshits world
500,follow interests twitter
501,uvillage store fits microsoft consumer strategy microsoft technology
502,probably neded thank god o.k good day across pond
503,good morning chubbx today
504,love twitter name
505,thats really sad wolud hate choco milk earlier lol
506,twitter honey dont freaking know anymore
507,worlds tweeted moments link story twitter
508,microsoft cloud infosys kicks cloud drive microsoft partnership infosys accelerated tcn
509,great see following us well
510,mate thats rubbish hug tom covered spots obviously happy doc says nothing bad tell tom
511,morning
